 2012-06-14  19:47:12 ;SAYEDBHN; تقرير-ملكُ  البحرين  يهدد  الأمين  العام  لجمعية  الوفاق  http://bit.ly/KxvBVn  @  WEFAQGS  @  BahrainNation  #  Bahrain  #  Feb14  #  Alwefaq  #  Arabspring  #  BHRlly 
 2012-06-14  19:43:55 ;perfectsliders; #  Iran  once  saw  #  ArabSpring  as  a  prime  opportunity,  now  watching  fall  of  its  top  Arab  ally,  the  #  Syria  http://goo.gl/fb/qYFJU  #  News 
 2012-06-14  19:43:53 ;Heyyoustartedit; Don't  want  to  say  I  told  you  so,  but....  #  Egypt  #  EgyPresElec  #  ArabSpring 
 2012-06-14  19:41:32 ;LiChangNY; Stay  tuned  in  RAS  Mobility  Monitor:  RT  @  icefmonitor:  #  ArabSpring,increased  demand  coming  for  US?  http://bit.ly/LN1LeN  #  SaudiArabia  @  WESFans 
 2012-06-14  19:37:28 ;Eliii_as; الربيع  العربي  #  LOL  #  ArabSpring  pic.twitter.com/au7PmeRx 
 2012-06-14  19:34:54 ;BasemAlh; Aiming  for  a  goal...  Requires  only  patience  and  sacrifices  ...  #  arab  #  arabspring 
 2012-06-14  19:30:32 ;BasemAlh; الوصول  لهدف  ما  ...  لا  يتطلب  سوى  الصبر  والتضحية  ..  #  arab  #  arabspring 
 2012-06-14  19:22:02 ;Nawalysy; {  وإذ  يمكر  بك  الذين  كفروا  ليثبتوك  أو  يقتلوك  أو  يخرجوك  ويمكرون  ويمكر  الله  والله  خير  الماكرين}  #  Syria  #  Egypt  #  Arabspring  #  سوريا  #  مصر  #  أمتي 
 2012-06-14  19:17:36 ;SAYEDBHN; تقرير  -  الحُكم  في  قضية  الكادر  الطبي  البحريني  http://bit.ly/KqQAI4  #  Bahrain  #  FEB14  #  Arabspring  @  DrAlekri  @  alsaffarrula  #  LuluTV  #  Alwefaq 
 2012-06-14  19:10:51 ;MrsHandala2; @  georgegalloway  #  bahrain  #  arabspring  #  ireland  http://yfrog.com/oe7dbffej   No  one  wishes  this  on  anyone  let  alone  a  http://tl.gd/hrhud2 
 2012-06-14  19:10:35 ;MrsHandala2; @  nytjim  #  bahrain  #  arabspring  #  ireland  http://yfrog.com/oe7dbffej   No  one  wishes  this  on  anyone  let  alone  a  http://tl.gd/hrhud2 
 2012-06-14  19:10:02 ;MrsHandala2; @  Jeannie_Hartley  #  bahrain  #  arabspring  #  ireland  http://yfrog.com/oe7dbffej   No  one  wishes  this  on  anyone  let  alone  a  http://tl.gd/hrhud2 
 2012-06-14  19:09:58 ;lumahaimike; I  guess  Ill  be  postponing  my  vacation  to  the  pyramids  of  Giza  for  a  few  years!  #  coup  #  arabspring 
 2012-06-14  19:09:53 ;FXtradingMentor; RT  @  alaidi:  So  many  "experts"  predicting  #  Algeria  would  fall  into  #  ArabSpring  but  #  Egypt  Court  decision  might  send  Egypt  into  Algeria  90s... 
 2012-06-14  19:09:53 ;CJOLars; RT  @  alaidi:  So  many  "experts"  predicting  #  Algeria  would  fall  into  #  ArabSpring  but  #  Egypt  Court  decision  might  send  Egypt  into  Algeria  90s... 
 2012-06-14  19:09:29 ;alaidi; So  many  "experts"  predicting  #  Algeria  would  fall  into  #  ArabSpring  but  #  Egypt  Court  decision  might  send  Egypt  into  Algeria  90s  scenrio 
 2012-06-14  19:08:53 ;MrsHandala2; #  bahrain  #  arabspring  #  ireland  http://yfrog.com/oe7dbffej   No  one  wishes  this  on  anyone  let  alone  a  CHILD..  for  (cont)  http://tl.gd/hrhud2 
 2012-06-14  19:05:22 ;VictoriaGilad; None  of  the  events  in  #  Syria  can  be  understood  outside  the  chaos  provoked  by  the  West  with  the  so-called  #  ArabSpring  http://bit.ly/L6Pd0T 
 2012-06-14  19:04:13 ;gtroya; Egipt  military  accused  of  #  coup.  @  cnni  #  Arabspring  betrayeld. 
 2012-06-14  18:59:20 ;gilcarvr; perfect  RT  @  MLAS:  Biden  Praises  #  ArabSpring  on  Same  Day  #  Egypt  Dissolves  Its  Parliament  http://is.gd/kX8y0I 
 2012-06-14  18:50:24 ;MLAS; Biden  Praises  #  ArabSpring  on  Same  Day  #  Egypt  Dissolves  Its  Parliament  http://is.gd/kX8y0I  #  tcot  #  sgp  #  p2 
 2012-06-14  18:49:04 ;Seif_24; La  liberté  n'est  pas  l'absence  d'engagement,  mais  la  capacité  de  choisir..  #  Freedom  #  ArabSpring 
 2012-06-14  18:46:52 ;Al_Welayah; تقرير  -  حريةُ  التعبير  في  #  مصر  والعالم  العربي  http://youtu.be/dR5uEed9nJQ  #  BAHRAIN  #  14FEB  #  Lulu  #  Twit4BH  #  ALWEFAQ  #  FEB14  #  Bah  #  Egypt  #  ArabSpring 
 2012-06-14  18:45:42 ;mog7546; #  Iran  NEEDS  more  schools,  hospitals  &  social  services,  clean  water  -  NOT  arming  #  Assad  #  Hezbollah  &  NUKES!!!  Free  IRAN  -  #  ArabSpring 
 2012-06-14  18:42:17 ;BAH_Videos; المالكية  |  مسيرة  الشعب  أسقط  شرعية  النظام  14-6-2012  http://m.youtube.com/#/watch?desktop_uri=%2Fwatch%3Fv%3DY8EpaJKMnSQ%26feature%3Dyoutu.be&feature=youtu.be&v=Y8EpaJKMnSQ&gl=US …  #  bahrain  #  14feb  #  arabspring  #  Kuwait  #  Oman  #  Egypt  #  ksa 
 2012-06-14  18:38:23 ;JoyKeller1; "That's  it  for  Egypt's  so-called  transition"  http://www.al-monitor.com/pulse/originals/2012/al-monitor/egypt-dissolves-parliament.html …  #  ArabSpring  #  Egypt 
 2012-06-14  18:34:04 ;nemro1; الاحكام  التي  صدرت  اليوم  بمصر  لم  ينقصها  الا  قول  (حكمت  المحكمة  حضورياً  ببراءة  حسني  السيد  مبارك  وتخليه  عن  التنحي  عن  منصبه).  #  Eygpt  #  ArabSpring 
 2012-06-14  18:32:36 ;JoyKeller1; Egyptian  Media  Attacks  Muslim  Brotherhood  ------>  http://www.al-monitor.com/pulse/politics/2012/06/local-newspapers-reignite-the-pr.html …  via  @  AlMonitor  #  ArabSpring 
 2012-06-14  18:30:13 ;aramiskenderian; Chaos  in  Egypt:  Parliament  dissolved.  #  arabspring  http://j.mp/LXORqo 
 2012-06-14  18:24:49 ;algamz1; _:  تعميم  سري  يبين  مخططات  الصفويين  لنشر  التشيع  في  العالم  الاسلامي.  #  arabspring  #  news  #  kuwait  #  ksa  #  qatar  #  uae  @  safa_tvpic.twitter.com/RkZsiln6 
 2012-06-14  18:21:54 ;kherye; شهرزاد  الجعفري:  أصبحت  كبش  محرقة  -  أ.  ف.  ب.:  قالت  شهرزاد  الجعفري،  ابنة  سفير  النظام  السوري  في...  http://bit.ly/MKTpjw  #  arabspring  #  lebanon 
 2012-06-14  18:13:01 ;SayedYousif; Marks  of  torture  on  head  of  a  newly  released  boy  from  Shahrakkan.  #  Bahrain  @  SanjeevBery  @  HRW  #  ArabSpring  pic.twitter.com/SPdWumzq 
 2012-06-14  18:12:55 ;irishspy; Coup  in  Egypt?  Court  dissolves  parliament,  military  takes  control  http://bit.ly/LdgCzo  #  tcot  #  egypt  #  ArabSpring 
 2012-06-14  18:03:56 ;paintmyblues; !STOP  Syria's  murderers!  #  STOPMassacres  The  People  of  #  Syria  need  the  solidarity  of  the  PEOPLE  of  the  #  World  !!!!!  NO  nato  !!!!!  #  ArabSpring 
 2012-06-14  18:03:21 ;MRC221; #  Egypt  #  ArabSpring  #  fail 
 2012-06-14  18:02:20 ;Deepak_Minhas79; What  #  ArabSpring?  @  ericmargolis:  Military  intends  to  crush  democracy  in  Egypt.  Viol  imminent  if  generals  get  way  &  cont  counter-revolution 
 2012-06-14  18:02:05 ;al4wi; فرانس  24:واشنطن  تدعو  البحرين  الى  اسقاط  التهم  عن  جميع  العاملين  الطبيين  المعتقلين  http://www.france24.com/ar/node/795815  #  Bah  #  ArabSpring  #  alwasat  #  UK  #  USA 
 2012-06-14  18:00:55 ;jenkrimm; overwhelmed  by  the  hospitality  of  the  Libyan  people...  People  I  met  in  passing  have  shared  their  homes  their  #  arabspring  stories  with  me 
 2012-06-14  17:59:48 ;newstruthliz; #  Egypt's  highest  ct  dissolves  parliament,  clears  former  Mubarak  aide  4  runoff  in  blow  2  Muslim  Brotherhood.  #  arabspring  http://bloom.bg/LEK3sI 
 2012-06-14  17:59:42 ;al4wi; تقرير  قناة  الميادين  حول  محاكمة  الأطباء  14-6-2012  http://youtu.be/dJZi-8979Q8  #  Bahrain  #  14Feb  #  alwefaq  #  GCC  #  ArabSpring  #  Lulu  #  Bah  #  Bh 
 2012-06-14  17:59:24 ;malkiya_14feb; قرية  المرخ  :  الان  الاطارات  تشتعل  استنكاراً  لما  يحدث  من  اعتقالات  في  بعض  قرى  البحرين  #  Bahran  #  14feb  #  alwefaq  #  ArabSpring  #  ksa 
 2012-06-14  17:56:34 ;ZahrasjAlalawi; هناك  فرق  بين  شاسع  بين  الاعتدال  و  الوسطية  !  أن  تكون  وسطياً  يعني  أن  تكون  منافقاً  مع  مرتبة  الشرف  !  #  Bahrain  #  Alwefaq  #  14Feb  #  Arabspring 
 2012-06-14  17:55:49 ;noohbh; (Bahrain:  diving  into  a  forbidden...:  http://youtu.be/wAyBgHPWM_8   الفلم  الفرنسي  عن  ثورة  البحرين  #  bahrain  #  france  #  14feb  #  arabspring  #  feb14  #  usa 
 2012-06-14  17:55:17 ;politalogue; Egypt’s  Slow-Motion  Coup  http://dlvr.it/1jtfjS  #  AmericanLeadership  #  ArabSpring  #  Egypt  #  heritage  #  tcot 
 2012-06-14  17:53:31 ;malkiya_14feb; حسن  عبد  النبي  ||  عاجل:  اعتقال٢٨  شخص  من  قرية  عالي  منذ  قليل  بعد  كمين  غادر  بمساعدة  بعض  المخبرين  المجرمين،،  #  14Feb  #  #  ArabSpring  #  Bahrain 
 2012-06-14  17:51:53 ;kherye; اشتباكات  بالأسلحة  الثقيلة  بين  منطقتين  في  ليبيا  -  وكالة  الأنباء  القطرية:  تجددت  الاشتباكات  مس...  http://bit.ly/LIn131  #  arabspring  #  lebanon 
 2012-06-14  17:41:52 ;NaderAbdulEmam; احكام  الكادر  الطبي  لم  ترضي  المعارضة  ولم  ترضي  الموالاة  ولم  ترضي  الحليف  الاستراتيجي  امريكا  .  #  14feb  #  arabspring  #  Bahrain  #  gcc 
 2012-06-14  17:40:55 ;Mediolana; Supreme  Constitutional  Court  of  #  Egypt  dissolves  elected  parliament,  green  lights  ancien  regime  officials  #  ArabSpring  http://tinyurl.com/cn54ja5 
 2012-06-14  17:40:49 ;Noora_Q; متظاهرون  البحرين  لايعرفون  سبب  اعتصامهم  http://www.youtube.com/watch?v=U0wEr0V2iP8&feature=relmfu …  #  Bahrain  #  Saudi  #  Kuwait  #  Qatar  #  Oman  #  UAE  #  Arabspring  #  Egypt  #  Iraq  #  Lebanon  #  ksa 
 2012-06-14  17:39:05 ;Media_Karbabad; #  bahrain  #  karbabad  #  14feb  #  arabspring  كرباباد  :  رغم  كثرة  الاصابات  بسلاح  الشوزن  المحرم  دولياً  و  لكن  و  لله  الحمد...  http://fb.me/1v3NU10uD 
 2012-06-14  17:33:11 ;iyad_elbaghdadi; I'm  pretty  sure  the  #  ArabSpring  has  so  far  had  quite  a  negative  influence  on  my  health. 
 2012-06-14  17:28:49 ;saramarietweets; Those  of  us  who  thot  #  arabspring  wasn’t  so  great,  proof-  #  Egypt,  #  military  takes  control  http://www.cnn.com/2012/06/14/world/meast/egypt-ruling/index.html …  #  in  #  LNYBT  @  SriramaTanniru 
 2012-06-14  17:21:31 ;kherye; الاسلاميون  التونسيون  يتراجعون  عن  تنظيم  تظاهرات  الجمعة  -  أ.  ف.  ب.:  اعلن  حزب  النهضة  التونسي  ...  http://bit.ly/Nn8AoR  #  arabspring  #  lebanon 
 2012-06-14  17:18:48 ;BHFreeMan; عاجل:  اعتقال٢٨  شخص  من  قرية  عالي  منذ  قليل  بعد  كمين  غادر  بمساعدة  بعض  المخبرين  المجرمين،،  #  14Feb  #  #  ArabSpring  #  Bahrain 
 2012-06-14  17:17:47 ;AsiaPacificMemo; Indonesia’s  unconsolidated  democracy:  prelude  to  2014  (Memo  163)  -  http://tinyurl.com/APMemo163  #  Indonesia  #  democracy  #  arabspring  #  liberal 
 2012-06-14  17:15:26 ;kherye; فتيات  يتنافسن  على  لقب  ملكة  جمال  حب  الملوك  بالمغرب:  انطلقت  رسمياً  منافسات  ملكة  جمال  موسم  فاك...  http://bit.ly/MKECFm  #  arabspring  #  lebanon 
 2012-06-14  17:14:00 ;HabibAlBahrain; "  @  Maqaba14:  #  bahrain  #  arabspring  #  البحرين  الدراز  مسيرة  كسر  القيود  14/6/2012  التي  تطالب  بالحرية  للمساجين  في  سجون  ال...  http://fb.me/1JJ9KfKJE " 
 2012-06-14  17:13:05 ;Syria_Brk; مرسي:  إن  وقعت  اي  محاولات  تزوير  فالثورة  ستصبح  أكثر  شراسة  #  arabspring  #  Suhail_TV 
 2012-06-14  17:13:05 ;Syria_Brk; مرسي:  أدعو  كل  المصريين  إلى  التكاتف  ضد  أي  محاولة  تزوير  للانتخابات  #  egypt  #  arabspring  #  Suhail_TV 
 2012-06-14  17:13:02 ;Syria_Brk; مرسي:  الثورة  قائمة  والسلطة  ستنتقل  من  العسكر  الى  السلطة  المدنية  المنتخبة  #  arabspring  #  Suhail_TV 
 2012-06-14  17:13:02 ;Syria_Brk; مرسي:  الثورة  قائمة  ومستمرة  والسلطة  ستنتقل  من  العسكر  الى  السلطة  المدنية  المنتخبة  #  arabspring  #  Suhail_TV 
 2012-06-14  17:12:41 ;saibef; #  ILikedThis,  RT  "  @  Mohamed_7elmy:  @  saibef  if  you  never  try..  you  will  never  know  #  coldplay"  #  LivingThePlayNow  #  Egypt  #  ArabSpring 
 2012-06-14  17:10:05 ;hassanabdalnabi; عاجل:  اعتقال٢٨  شخص  من  قرية  عالي  منذ  قليل  بعد  كمين  غادر  بمساعدة  بعض  المخبرين  المجرمين،،  #  14Feb  #  #  ArabSpring  #  Bahrain 
 2012-06-14  17:08:28 ;BAH_Videos; كلمة  بإسم  أمهات  الشهادء  تلقيها  والدة  الشهيد  علي  مشيمع  #  bahrain  #  14feb  #  arabspring  #  kuwait  #  oman  #  gcc  http://www.youtube.com/watch?v=gsb4LMiJy1w&feature=youtube_gdata_player … 
 2012-06-14  17:05:47 ;Media_Karbabad; #  bahrain  #  karbabad  #  14feb  #  lulu  #  arabspring  كرباباد  :  الثوار  واجهوا  المرتزقة  وجهاً  لوجه  في  كوبري  14  فبراير  ولم...  http://fb.me/1GRyuF6gb 
 2012-06-14  17:00:51 ;LSEReviewBooks; Do  Western  interpretations  of  the  #  ArabSpring  place  too  much  emphasis  on  social  media  and  the  worry  over  Islamism?  http://bit.ly/K2JnZw 
 2012-06-14  17:00:36 ;BroojAA; @  NotUntilHeFalls  @  womanfromyemen  not  a  men  year  ;  viva  #  arabspring  ^^ 
 2012-06-14  16:56:04 ;Syria_Brk; مرسي:  أؤكد  لكم  أنني  مستمر  في  ترشيحي  لاستكمال  المسيرة  #  arabspring  #  Suhail_TV 
 2012-06-14  16:56:04 ;Syria_Brk; مرسي:  ستكون  حياتي  ثمنا  لحرية  هذا  الشعب  ولمنع  أي  محاولة  تزوير  #  arabspring  #  Suhail_TV 
 2012-06-14  16:56:04 ;Syria_Brk; مرسي:  المصريون  يرفضون  محاولات  البعض  لاعادة  بقايا  نظام  مبارك  #  egypt  #  arabspring  #  Suhail_TV 
 2012-06-14  16:55:34 ;Syria_Brk; مرسي  يدعو  المصريين  الى  مواصلة  مسيرتهم  للقضاء  على  الفساد  #  egypt  #  arabspring  #  Suhail_TV 
 2012-06-14  16:55:34 ;Syria_Brk; مرسي:  إما  ان  نعيد  حق  الشهداء  وإما  ان  نتحول  إلى  شهداء  بدورنا  #  arabspring  #  Suhail_TV 
 2012-06-14  16:55:34 ;Syria_Brk; مرسي:  الأحكام  الصادرة  عن  المحكمة  العليا  بحل  البرلمان  ظالمة  #  arabspring  #  Suhail_TV 
 2012-06-14  16:55:34 ;Syria_Brk; مرسي:  الأحكام  الصادرة  عن  المحكمةالعليا  بحل  البرلمان  ظالمة  #  arabspring  #  Suhail_TV 
 2012-06-14  16:55:33 ;Syria_Brk; مرسي:  الأحكام  الصادرة  عن  المحكمةالعليا  بحل  البرلمان  ظالم  #  arabspring  #  Suhail_TV 
 2012-06-14  16:55:33 ;Syria_Brk; مرسي:  أؤكد  أن  مهمتي  كرئيس  للجمهورية  السهر  على  تحقيق  أهداف  الثورة  #  arabspring  #  Suhail_TV 
 2012-06-14  16:55:33 ;Syria_Brk; مرسي:  أعلن  والشعب  المصري  استمرار  التحدي  لاسقاط  بقاياالنظام  #  egypt  #  arabspring  #  Suhail_TV 
 2012-06-14  16:55:33 ;Syria_Brk; مرسي:  الشرعية  الشعبية  اسقطت  مبارك  وحزبه  وامنه  وبرلمانه  ودستوره  #  egypt  #  arabspring  #  Suhail_TV 
 2012-06-14  16:55:32 ;Syria_Brk; مرسي:  الشعب  المصري  لن  يقبل  بتزوير  ارادته  من  قبل  ازلام  مبارك  #  egypt  #  arabspring  #  Suhail_TV 
 2012-06-14  16:55:32 ;Syria_Brk; مرسي  :  ازلام  مبارك  افسدوا  الحياة  السياسية  #  egypt  #  arabspring  #  Suhail_TV 
 2012-06-14  16:55:20 ;equLT; .  @  AbirKopty:  Just  keep  fighting  for  every  person  who  is  oppressed,  powerless,  deprived  her  rights  &  dignity  http://abirkopty.wordpress.com/2012/06/14/a-message-from-palestine-to-our-arab-fellows/#more-1005 …  #  arabspring 
 2012-06-14  16:55:11 ;Media_Karbabad; #  bahrain  #  karbabad  #  14feb  #  lulu  #  arabspring  مواجهات  استشهادية  في  بلدة  كرباباد  على  كوبري  14  فبراير  واصابات  مباشرة  للثوار  برصاص  الشوزن 
 2012-06-14  16:52:26 ;iyad_elbaghdadi; I  walk  in  the  door.  Wife  asks  me  how  was  my  day.  I  say  I'm  tired  and  exhausted  and  frustrated  and  depressed.  Welcome  to  the  #  ArabSpring. 
 2012-06-14  16:51:47 ;BahrainArt; فنك  الثوري..  شاركه  معنا  لكي  ننشره  للعالم  ارسل  لنا  تفاصيل  اعمالك  على  اللنك  التالي  http://bahrainart.com/en/shareyourart  #  Bahrain  #  ART  #  US  #  UK  #  ArabSpring 
 2012-06-14  16:51:07 ;kherye; إجراءات  أمنية  مشددة  لمواجهة  هجمات  محتملة  للقاعدة  في  اليمن  -  وكالة  الأنباء  الجزائرية:  أكدت  و...  http://bit.ly/LcZF8i  #  arabspring  #  lebanon 
 2012-06-14  16:50:31 ;beekinleadman; Egypt's  highest  court  declared  the  parliament  invalid  http://www.cnn.com/2012/06/14/world/meast/egypt-ruling/index.html …  How's  that  #  ArabSpring  workin  for  ya? 
 2012-06-14  16:50:10 ;Media_Karbabad; #  bahrain  #  karbabad  #  14feb  #  lulu  #  arabspring  كرباباد  :  الثوار  يسطر  اروع  ملاحم  الصموود  و  التحدي  و  لليلة  الثانية...  http://fb.me/1pG57iOiJ 
 2012-06-14  16:48:48 ;XMrJusticeX; #  ArabSpring  -  Libyan  rebellion  army  had  talks  with  Rothschild  and  other  elites  prior  to  civil  war  -  documented  FACT!!! 
 2012-06-14  16:47:05 ;XMrJusticeX; #  ArabSpring  was  engineered  by  CIA  to  soften  opinion  for  military  intervention  in  Libya.  All  about  the  oil  peeps 
 2012-06-14  16:46:22 ;sayedhadi; الضغط  كبير  على  النظام  للرضوخ  ومحاورة  المعارضة،  علينا  الصبر  والصمود  والثبات  #  ALJAZEERA  #  ALWEFAQ  #  ARABSPRING  #  BAHRAIN 
 2012-06-14  16:46:20 ;iyad_elbaghdadi; I  think  my  wife  resents  the  #  ArabSpring  for  how  much  it  affects  my  mood. 
 2012-06-14  16:45:06 ;ASLANmedia; #  BAHRAIN  Nine  medics  convicted  for  role  in  #  Feb14  uprising  while  another  nine  acquitted.  http://ow.ly/bArAl  #  ArabSpring  #  MidEast  #  News 
 2012-06-14  16:36:02 ;Syria_Brk; شبكة  شام  الاخبارية  :  جيش  النظام  ينفذ  مجزرة  في  حمورية  بريف  دمشق  #  syria  #  arabspring  #  Suhail_TV 
 2012-06-14  16:30:29 ;iSethS; Over  a  year  after  the  start  of  the  #  ArabSpring  and  the  #  MiddleEast  is  just  #  chaos.  #  Egypt  #  Syria  #  Yemen 
 2012-06-14  16:26:59 ;M0998080832My; الى  احرار  العرب  :  لنافي  تاريخ  العرب  القريب  عظةوعبرة  ولانتبع  الضال  منة،الخلافات  إنتهت  بمنة  الله  وفضلة.  #  Syria  #  سوريا  #  arabspring  #  الثورة 
 2012-06-14  16:23:49 ;implowshun; Guess  I  can  ignore  #  Egypt  for  a  while.  No  #  ArabSpring  or  any  other  kind  of  #  Democracy  #  Revolution  going  on  there.  AmSure  they'll  awake  again 
 2012-06-14  16:22:51 ;wheelscomp; Egyptian  military  invalidates  legislature.  Didn't  see  that  one  coming...  #  arabspring 
 2012-06-14  16:19:22 ;_AboZakariya; military  coup  in  #  Egypt,  Morsi/Shafiq  an  intolerable  choice  #  ArabSpring  http://www.washingtonpost.com/opinions/david-ignatius-in-egypt-a-sense-of-dread/2012/06/14/gJQAHVb2cV_story.html … 
 2012-06-14  16:16:04 ;FatmaJawad; كم  تفجير  وقع  بالأمس  في  #  العراق  ؟  كم  شهيد  و  كم  جريح  ؟  كم  طفل  سرقت  أمانيه  و  كم  يتيم  ؟  مالكم  كيف  تحكمون  #  ArabSpring 
 2012-06-14  16:15:31 ;taha9988; @  newsaali  اهداء  متواضع  لسماحة  الشيخ  علي  سلمان  http://www.youtube.com/watch?v=BGFVfSwg7ls …  #  14feb  #  Alwefaq  #  gcc  #  البحريـن  #  ArabSpring  #  BAH 
 2012-06-14  16:14:14 ;oyoon_bahrain; RT  @  FreeDumistan  RT  @  albhrani2011:  هل  يوجد  إختلاف  بين  الدرة  والنهام!!!!  #  Bahrain  #  14feb  #  TGONU  #  ArabSpring  @  Bahrain...  http://tl.gd/hrh36r 
 2012-06-14  16:09:06 ;mog7546; #  Iran  NEEDS  more  schools,  hospitals  &  social  services  -  NOT  arming  #  Assad  &  #  Hezbollah  +  NUKES!!!  #  FreeIRAN  of  dictatorship  -  #  ArabSpring 
 2012-06-14  16:04:07 ;highbg; #  Egypt:  #  Women  #  Sexually  #  Assaulted  at  #  March  Against  #  Sexual  #  Harassment  -  Yahoo!  News  http://news.yahoo.com/egypt-women-sexually-assaulted-march-against-sexual-harassment-004250792--abc-news-topstories.html …  via  @  YahooNews  #  ArabSpring 
 2012-06-14  16:02:30 ;anacorri; Egypt's  chaotic  transition  #  ArabSpring  http://www.guardian.co.uk/world/middle-east-live/2012/jun/14/syria-crisis-war-crimes-evidence-live … 
 2012-06-14  16:02:30 ;BrowneGareth; Egyptian  parliament  dissolved  today...  Huge  step  backwards,  needs  to  be  resolved  asap  #  egypt  #  arabspring  #  syria 
 2012-06-14  16:00:31 ;SAYEDBHN; 9  Medics  Convicted  in  #  Bahrain  |  Project  on  Middle  East  Democracy  (POMED)  http://bit.ly/LcPfFw  #  Feb14  @  BahrainNation  #  Arabspring  #  UN  #  UK 
 2012-06-14  15:50:24 ;kherye; الفلسطينيون  ينددون  برأي  خبراء  اليونيسكو  حول  كنيسة  المهد  في  بيت  لحم  -  أ.  ف.  ب.:  اعلن  مسؤول...  http://bit.ly/MSTyor  #  arabspring  #  lebanon 
 2012-06-14  15:44:47 ;NYCSuperMan; New  Political  Showdown  in  #  Egypt  as  Court  Invalidates  Parliament  http://nyti.ms/M7vFVy  #  ArabSpring  #  democracy 
 2012-06-14  15:37:41 ;JessyDoulette; Màj  @  Pearltrees  #  ArabSpring  :  #  Tunisie  #  Syrie  #  Bahreïn  #  Egypte  //  #  Acta  #  presse  #  Censure  http://is.gd/tqLJb8 
 2012-06-14  15:34:04 ;SAYEDBHN; Facing  prison  for  treating  #  Bahrain-s  wounded  -  http://Philly.com   http://bit.ly/K5Kl7L  #  Feb14  #  Arabspring  @  BahrainNation 
 2012-06-14  15:33:04 ;safzath; #  Egyptian  Court  Dissolves  Parliament,  Sparks  Chaos,  Coup  Accusations:  More  About:  #  ArabSpring,  Egypt,  #  Revolution,...  http://goo.gl/mwS5c 
 2012-06-14  15:33:01 ;LaraHost; #  Uncategorized  #  ArabSpring  Egyptian  Court  Dissolves  Parliament,  Sparks  Chaos,  Coup  Accusations  http://n.larahost.com/1jsWG3  #  TeamFollowBack 
 2012-06-14  15:32:33 ;kevinvanderbijl; Egyptian  Court  Dissolves  Parliament,  Sparks  Chaos,  Coup  Accusations  http://dlvr.it/1jsW4M  #  Uncategorized  #  ArabSpring 
 2012-06-14  15:25:44 ;pateriot14; The  revolution  is  the  explosive  moment  of  human  freedom.  #  arabspring  #  Bahrain  #  Syria  #  facts  #  us  #  uk  #  usa 
 2012-06-14  15:25:30 ;PT_Foundation; #  Iran  to  execute  5  #  Arab  men  says  #  Amnesty  READ:  http://goo.gl/Mbjhd  #  ArabSpring  #  MENA  #  Tehran  #  OWS  #  Occupy  #  AntiWar  #  STWuk  @  Amnesty  @  HRW 
 2012-06-14  15:25:03 ;Syria_Brk; كلينتون:  نتوقع  أن  ينقل  المجلس  العسكري  السلطات  إلى  سلطة  مدنية  منتخبة  #  arabspring  #  Suhail_TV 
 2012-06-14  15:25:03 ;Syria_Brk; كلينتون:  لا  يمكن  التراجع  عن  التحول  الديمقراطي  الذي  طالب  به  الشعب  المصري  #  egypt  #  arabspring  #  Suhail_TV 
 2012-06-14  15:19:40 ;kimbiz; @  IsraelActivism  #  military  #  coup  #  Egypt  #  violence  #  arabspring  and  more  lives  will  be  brought  to  the  slaughterhouse  for  our  freedom..any  day! 
 2012-06-14  15:18:19 ;BAH_Videos; البحرين  ..  إصابة  الطفل  أحمد  ناصر  النهام  بسلاح  الشوزن  #  bahrain  #  14feb  #  arabspring  #  kuwait  #  oman  #  gcc  http://www.youtube.com/watch?v=UpPf77mJ3UY&feature=youtube_gdata_player … 
 2012-06-14  15:15:59 ;IsraelActivism; It  appears  that  a  #  military  #  coup  has  taken  place  in  #  Egypt.  Expect  massive  #  violence.  #  arabspring 
 2012-06-14  15:15:09 ;ASLANmedia; #  EGYPT  #  HumanRight  advocates  challenge  broad  military  powers  to  arrest  civilians.  http://ow.ly/bAnbL  #  Jan25  #  MidEast  #  ArabSpring  #  News 
 2012-06-14  15:10:33 ;EAAZuz; This  was  a  bad  week  for  #  Arabspring  Revs.  Got  bombarded  from  all  fronts  by  god  seekers,  past  dreamers  and  unholy  army.  #  RIP 
 2012-06-14  15:07:08 ;KarzakkanNews; #  Bahrain  #  14Feb  #  Un  #  Gcc  #  News  #  Arabspring  #  Karzakkan  #  World  كرزكان  نيوز:المرتزقة  بالاجياب  بالقرب  من  ملعب  زيكو...  http://fb.me/1L6M2vGiZ 
 2012-06-14  15:07:05 ;Syria_Brk; لجان  التنسيق:  60  قتيلا  برصاص  الأمن  السوري  اليوم  #  syria  #  arabspring  #  Suhail_TV 
